{"v": 1, "ticket": "17", "issued_at": "2026-08-27T10:30:00Z", "expires_at": "2026-08-27T14:30:00Z", "issued_by": {"kind": "human", "login": "cengiz", "environment": "approval", "approval_run_id": 1}, "requested_by": "cengiz", "ticket_digest": "sha256:aaaaaaaaaaaaaaaaaaaaaaaaaaaaaaaaaaaaaaaaaaaaaaaaaaaaaaaaaaaaaaaa", "scope": {"agents": ["coder"], "paths": ["src/verify/**", "tests/**"], "zones": [1, 2], "max_actions": 5}, "sig": {"alg": "ed25519", "bundle": "cGxhY2Vob2xkZXI=", "rekor_index": 0}}